{
  "schema_version": "1.0",
  "comparison_id": "cmp-0001",
  "created_wall_time": "2026-10-20T00:00:00+05:30",
  "profile": "accuracy",
  "runs": [
    "run-a",
    "run-b"
  ],
  "compatible": false,
  "allow_noncomparable": true,
  "reasons": [
    {
      "field": "policies.text",
      "values": [
        "a",
        "b"
      ],
      "effect": "blocks_ranking"
    }
  ],
  "rows": [
    {
      "run_id": "run-a",
      "metric": "wer",
      "metric_record": {
        "status": "ok",
        "value": 0.6666666666666666,
        "unit": "ratio",
        "definition_id": "wer_v1",
        "sample_count": 3,
        "clock_domain": "none",
        "reason": null,
        "components": {
          "substitutions": 1,
          "deletions": 0,
          "insertions": 1,
          "reference_tokens": 3
        }
      }
    }
  ],
  "ranking": null
}
